{
  "artifact_type": "live_tactic_candidate",
  "candidate_id": "ltc_example_001",
  "layer": "tactic",
  "status": "staged",
  "workspace_id": "ecitr_model",
  "promotion_basis": "case_cluster",
  "derivation_method": "live_case_cluster_v1",
  "source_case_refs": [
    "case_memory_gate_001",
    "case_memory_gate_002"
  ],
  "supporting_invariant_refs": [],
  "evidence_refs": [
    "ev_memory_gate_001",
    "ev_memory_gate_002"
  ],
  "entry": {
    "label": "live_direct_tactic_example",
    "promotion_basis": "case_cluster",
    "expected_decision": "approve",
    "title": "Live direct tactic: memory gate changes",
    "summary": "Use staged packets and review audit entries for memory gate changes.",
    "action": "Create staged packets, validate them, and activate only through the review workflow.",
    "source_case_refs": [
      "case_memory_gate_001",
      "case_memory_gate_002"
    ],
    "supporting_invariant_refs": []
  },
  "support_signals": {
    "score": 0.86,
    "shared_tokens": [
      "memory",
      "staging",
      "review",
      "canonical"
    ]
  },
  "counterexample_case_refs": [],
  "created_at": "2026-05-07T00:00:00.000Z",
  "last_seen_at": "2026-05-07T00:00:00.000Z",
  "revision": 1,
  "decision_history": []
}
